{
  "$schema": "https://json-schema.org/draft/2020-12/schema",
  "$id": "https://acp-remote.dev/schemas/sync/v1/event.schema.json",
  "title": "ACP Remote Sync v1 Event",
  "type": "object",
  "additionalProperties": false,
  "required": ["protocolVersion", "type", "messageId", "connectionId", "connectionSequence", "body"],
  "properties": {
    "protocolVersion": { "const": 1 },
    "type": { "const": "event" },
    "messageId": { "$ref": "common.schema.json#/$defs/uuid" },
    "connectionId": { "$ref": "common.schema.json#/$defs/uuid" },
    "connectionSequence": { "$ref": "common.schema.json#/$defs/decimalString" },
    "body": {
      "type": "object",
      "additionalProperties": false,
      "required": ["globalSequence", "sessionSequence", "eventId", "sessionId", "eventType", "causationRequestId", "origin", "remoteOrigin", "createdAt", "payload"],
      "properties": {
        "globalSequence": { "$ref": "common.schema.json#/$defs/decimalString" },
        "sessionSequence": {
          "oneOf": [{ "$ref": "common.schema.json#/$defs/decimalString" }, { "type": "null" }]
        },
        "eventId": { "$ref": "common.schema.json#/$defs/uuid" },
        "sessionId": {
          "oneOf": [{ "$ref": "common.schema.json#/$defs/uuid" }, { "type": "null" }]
        },
        "eventType": {
          "type": "string",
          "pattern": "^[a-z0-9_.-]{1,128}$"
        },
        "causationRequestId": {
          "oneOf": [{ "$ref": "common.schema.json#/$defs/uuid" }, { "type": "null" }]
        },
        "origin": {
          "type": "object",
          "additionalProperties": false,
          "required": ["kind", "deviceId"],
          "properties": {
            "kind": { "enum": ["agent", "device", "daemon", "local_cli", "node"] },
            "deviceId": {
              "oneOf": [{ "$ref": "common.schema.json#/$defs/uuid" }, { "type": "null" }]
            },
            "nodeId": {
              "oneOf": [{ "$ref": "common.schema.json#/$defs/uuid" }, { "type": "null" }]
            }
          },
          "if": {
            "properties": { "kind": { "const": "node" } },
            "required": ["kind"]
          },
          "then": {
            "required": ["nodeId"],
            "properties": {
              "deviceId": { "type": "null" },
              "nodeId": { "$ref": "common.schema.json#/$defs/uuid" }
            }
          }
        },
        "remoteOrigin": {
          "oneOf": [{ "$ref": "common.schema.json#/$defs/remoteOrigin" }, { "type": "null" }]
        },
        "createdAt": { "$ref": "common.schema.json#/$defs/timestamp" },
        "payload": {
          "type": "object",
          "additionalProperties": false,
          "required": ["view"],
          "properties": {
            "view": { "type": "object" },
            "acp": { "$ref": "common.schema.json#/$defs/rawAcp" }
          }
        }
      }
    }
  }
}
