{
  "protocolVersion": 1,
  "type": "event",
  "messageId": "717bdc0b-e6c8-4e10-a08e-dd9034194941",
  "connectionId": "2de54db7-74ae-4c21-88e3-05df0dc2e637",
  "connectionSequence": "67",
  "body": {
    "globalSequence": "2356",
    "sessionSequence": "216",
    "eventId": "22cdfba6-89db-4f7c-a276-1763dd21faf2",
    "sessionId": "5d73cd10-a465-43cd-b3f1-704e2d49e99e",
    "eventType": "tool.call.started",
    "causationRequestId": null,
    "origin": {
      "kind": "daemon",
      "deviceId": null,
      "nodeId": null
    },
    "remoteOrigin": null,
    "createdAt": "2026-09-17T12:12:00.000Z",
    "payload": {
      "view": {
        "toolCallId": "toolu_01H8xk",
        "turnId": "6601828b-3eca-4cec-9a58-18ae1e0a3a14",
        "title": "读取 schema",
        "state": "in_progress"
      }
    }
  }
}
