{
  "protocolVersion": 1,
  "type": "event",
  "messageId": "e3a9c6d2-1f47-4b80-a5e9-7c2d0b8f4a16",
  "connectionId": "2de54db7-74ae-4c21-88e3-05df0dc2e637",
  "connectionSequence": "76",
  "body": {
    "globalSequence": "2401",
    "sessionSequence": "118",
    "eventId": "b7f2d940-5c83-4a16-9e0d-1a6b3f8c2e57",
    "sessionId": "5d73cd10-a465-43cd-b3f1-704e2d49e99e",
    "eventType": "session.activity.changed",
    "causationRequestId": null,
    "origin": { "kind": "daemon", "deviceId": null, "nodeId": null },
    "remoteOrigin": null,
    "createdAt": "2026-10-22T09:45:00.000Z",
    "payload": {
      "view": {
        "session": {
          "sessionId": "5d73cd10-a465-43cd-b3f1-704e2d49e99e",
          "title": "回收后空闲",
          "agent": { "agentId": "codex", "name": "Codex" },
          "state": "idle",
          "localActivity": "idle",
          "origin": { "kind": "local" },
          "currentMode": null,
          "version": "49",
          "createdAt": "2026-09-17T11:00:00.000Z",
          "updatedAt": "2026-10-22T09:45:00.000Z"
        }
      }
    }
  }
}
