{
  "protocolVersion": 1,
  "type": "event",
  "messageId": "e1a2b3c4-d5e6-4f70-8192-a3b4c5d6e7f8",
  "connectionId": "2de54db7-74ae-4c21-88e3-05df0dc2e637",
  "connectionSequence": "30",
  "body": {
    "eventId": "f2b3c4d5-e6f7-4081-92a3-b4c5d6e7f809",
    "eventType": "agent.message.completed",
    "sessionId": "5d73cd10-a465-43cd-b3f1-704e2d49e99e",
    "sessionSequence": "41",
    "globalSequence": "128",
    "causationRequestId": null,
    "origin": { "kind": "agent", "deviceId": null, "nodeId": null },
    "remoteOrigin": null,
    "createdAt": "2026-10-19T12:00:02.000Z",
    "payload": {
      "view": {
        "messageId": "1a2b3c4d-5e6f-4a7b-8c9d-0e1f2a3b4c5d",
        "turnId": "2b3c4d5e-6f70-4a8b-9c0d-1e2f3a4b5c6d",
        "content": [
          { "type": "text", "text": "Here is the rendered image." },
          {
            "type": "image_ref",
            "mimeType": "image/png",
            "byteLength": "32768",
            "displayState": "available"
          }
        ],
        "channel": "reply",
        "partial": { "state": "completed", "reason": null }
      }
    }
  }
}
