{
  "protocolVersion": 1,
  "type": "event",
  "messageId": "a854747b-9ee8-4911-a4a4-10baabc12d08",
  "connectionId": "2de54db7-74ae-4c21-88e3-05df0dc2e637",
  "connectionSequence": "77",
  "body": {
    "globalSequence": "2366",
    "sessionSequence": null,
    "eventId": "3a7ce517-cc91-4a95-a628-5e850bae5c19",
    "sessionId": null,
    "eventType": "agent.disconnected",
    "causationRequestId": null,
    "origin": {
      "kind": "device",
      "deviceId": "2ae1c07c-9242-46e9-a9d2-4ec58c130f49",
      "nodeId": null
    },
    "remoteOrigin": null,
    "createdAt": "2026-09-17T12:12:00.000Z",
    "payload": {
      "view": {
        "agentId": "company-agent",
        "state": "disconnected",
        "error": {
          "code": "internal.unavailable",
          "message": "Agent 进程退出。",
          "retryable": true,
          "details": {}
        }
      }
    }
  }
}
